,Author,Text
0,a,"befell me in the person of Dr. Jekyll, I could enter on that of Edward Hyde without pecuniary loss. And thus fortified, as I supposed, on every side, I began to profit by the strange immunities of my position. Men have before hired bravos to transact their crimes, while their own person and reputation sat under shelter. I was the first that ever did so for his pleasures. I was the first that could plod in the public eye with a load of genial respectability, and in a moment, like a schoolboy, strip off these lendings and spring headlong into"
1,a,"was far from truly possessing, “you speak enigmas, and you will perhaps not wonder that I hear you with no very strong impression of belief. But I have gone too far in the way of inexplicable services to pause before I see the end.” “It is well,” replied my visitor. “Lanyon, you remember your vows: what follows is under the seal of our profession. And now, you who have so long been bound to the most narrow and material views, you who have denied the virtue of transcendental medicine, you who have derided your superiors—behold!” He put the glass to"
2,a,"edition. Shocking murder of an M.P.” That was the funeral oration of one friend and client; and he could not help a certain apprehension lest the good name of another should be sucked down in the eddy of the scandal. It was, at least, a ticklish decision that he had to make; and self-reliant as he was by habit, he began to cherish a longing for advice. It was not to be had directly; but perhaps, he thought, it might be fished for. Presently after, he sat on one side of his own hearth, with Mr. Guest, his head clerk,"
3,a,"creature was astute; mastered his fury with a great effort of the will; composed his two important letters, one to Lanyon and one to Poole; and that he might receive actual evidence of their being posted, sent them out with directions that they should be registered. Thenceforward, he sat all day over the fire in the private room, gnawing his nails; there he dined, sitting alone with his fears, the waiter visibly quailing before his eye; and thence, when the night was fully come, he set forth in the corner of a closed cab, and was driven to and fro"
4,a,"which stood within ran forth. At that time my virtue slumbered; my evil, kept awake by ambition, was alert and swift to seize the occasion; and the thing that was projected was Edward Hyde. Hence, although I had now two characters as well as two appearances, one was wholly evil, and the other was still the old Henry Jekyll, that incongruous compound of whose reformation and improvement I had already learned to despair. The movement was thus wholly toward the worse. Even at that time, I had not conquered my aversions to the dryness of a life of study. I"
5,a,"the civilities of my unhappy victim; I declare, at least, before God, no man morally sane could have been guilty of that crime upon so pitiful a provocation; and that I struck in no more reasonable spirit than that in which a sick child may break a plaything. But I had voluntarily stripped myself of all those balancing instincts by which even the worst of us continues to walk with some degree of steadiness among temptations; and in my case, to be tempted, however slightly, was to fall. Instantly the spirit of hell awoke in me and raged. With a"
6,a,"no postmark. The note was handed in.” “Shall I keep this and sleep upon it?” asked Utterson. “I wish you to judge for me entirely,” was the reply. “I have lost confidence in myself.” “Well, I shall consider,” returned the lawyer. “And now one word more: it was Hyde who dictated the terms in your will about that disappearance?” The doctor seemed seized with a qualm of faintness; he shut his mouth tight and nodded. “I knew it,” said Utterson. “He meant to murder you. You had a fine escape.” “I have had what is far more to the purpose,”"
7,a,"in his mind, just as he knew what was in mine; and killing being out of the question, we did the next best. We told the man we could and would make such a scandal out of this as should make his name stink from one end of London to the other. If he had any friends or any credit, we undertook that he should lose them. And all the time, as we were pitching it in red hot, we were keeping the women off him as best we could for they were as wild as harpies. I never saw"
8,a,"Here, at last, I had a chance of clearly seeing him. I had never set eyes on him before, so much was certain. He was small, as I have said; I was struck besides with the shocking expression of his face, with his remarkable combination of great muscular activity and great apparent debility of constitution, and—last but not least—with the odd, subjective disturbance caused by his neighbourhood. This bore some resemblance to incipient rigour, and was accompanied by a marked sinking of the pulse. At the time, I set it down to some idiosyncratic, personal distaste, and merely wondered at"
9,a,"had in Guest to dine with him; and the sixth he betook himself to Dr. Lanyon’s. There at least he was not denied admittance; but when he came in, he was shocked at the change which had taken place in the doctor’s appearance. He had his death-warrant written legibly upon his face. The rosy man had grown pale; his flesh had fallen away; he was visibly balder and older; and yet it was not so much these tokens of a swift physical decay that arrested the lawyer’s notice, as a look in the eye and quality of manner that seemed"
10,a,"learned to dwell with pleasure, as a beloved daydream, on the thought of the separation of these elements. If each, I told myself, could be housed in separate identities, life would be relieved of all that was unbearable; the unjust might go his way, delivered from the aspirations and remorse of his more upright twin; and the just could walk steadfastly and securely on his upward path, doing the good things in which he found his pleasure, and no longer exposed to disgrace and penitence by the hands of this extraneous evil. It was the curse of mankind that these"
11,a,"as old and commonplace as man; much the same inducements and alarms cast the die for any tempted and trembling sinner; and it fell out with me, as it falls with so vast a majority of my fellows, that I chose the better part and was found wanting in the strength to keep to it. Yes, I preferred the elderly and discontented doctor, surrounded by friends and cherishing honest hopes; and bade a resolute farewell to the liberty, the comparative youth, the light step, leaping impulses and secret pleasures, that I had enjoyed in the disguise of Hyde. I made"
12,a,"Hyde. If he could but once set eyes on him, he thought the mystery would lighten and perhaps roll altogether away, as was the habit of mysterious things when well examined. He might see a reason for his friend’s strange preference or bondage (call it which you please) and even for the startling clause of the will. At least it would be a face worth seeing: the face of a man who was without bowels of mercy: a face which had but to show itself to raise up, in the mind of the unimpressionable Enfield, a spirit of enduring hatred."
13,a,"of my intelligence, the moral and the intellectual, I thus drew steadily nearer to that truth, by whose partial discovery I have been doomed to such a dreadful shipwreck: that man is not truly one, but truly two. I say two, because the state of my own knowledge does not pass beyond that point. Others will follow, others will outstrip me on the same lines; and I hazard the guess that man will be ultimately known for a mere polity of multifarious, incongruous and independent denizens. I, for my part, from the nature of my life, advanced infallibly in one"
14,a,"of my life, which had been, after all, nine tenths a life of effort, virtue and control, it had been much less exercised and much less exhausted. And hence, as I think, it came about that Edward Hyde was so much smaller, slighter and younger than Henry Jekyll. Even as good shone upon the countenance of the one, evil was written broadly and plainly on the face of the other. Evil besides (which I must still believe to be the lethal side of man) had left on that body an imprint of deformity and decay. And yet when I looked"
15,a,"ran forth. At that time my virtue slumbered; my evil, kept awake by ambition, was alert and swift to seize the occasion; and the thing that was projected was Edward Hyde. Hence, although I had now two characters as well as two appearances, one was wholly evil, and the other was still the old Henry Jekyll, that incongruous compound of whose reformation and improvement I had already learned to despair. The movement was thus wholly toward the worse. Even at that time, I had not conquered my aversions to the dryness of a life of study. I would still be"
16,a,"the prospect had smiled with every promise of a cheerful and an honoured age; and now in a moment, friendship, and peace of mind, and the whole tenor of his life were wrecked. So great and unprepared a change pointed to madness; but in view of Lanyon’s manner and words, there must lie for it some deeper ground. A week afterwards Dr. Lanyon took to his bed, and in something less than a fortnight he was dead. The night after the funeral, at which he had been sadly affected, Utterson locked the door of his business room, and sitting there"
17,a,"been much less exercised and much less exhausted. And hence, as I think, it came about that Edward Hyde was so much smaller, slighter and younger than Henry Jekyll. Even as good shone upon the countenance of the one, evil was written broadly and plainly on the face of the other. Evil besides (which I must still believe to be the lethal side of man) had left on that body an imprint of deformity and decay. And yet when I looked upon that ugly idol in the glass, I was conscious of no repugnance, rather of a leap of welcome."
18,a,"Edward Hyde, alone in the ranks of mankind, was pure evil. I lingered but a moment at the mirror: the second and conclusive experiment had yet to be attempted; it yet remained to be seen if I had lost my identity beyond redemption and must flee before daylight from a house that was no longer mine; and hurrying back to my cabinet, I once more prepared and drank the cup, once more suffered the pangs of dissolution, and came to myself once more with the character, the stature and the face of Henry Jekyll. That night I had come to"
19,a,"“Who is going to do it?” “Why, you and me, sir,” was the undaunted reply. “That’s very well said,” returned the lawyer; “and whatever comes of it, I shall make it my business to see you are no loser.” “There is an axe in the theatre,” continued Poole; “and you might take the kitchen poker for yourself.” The lawyer took that rude but weighty instrument into his hand, and balanced it. “Do you know, Poole,” he said, looking up, “that you and I are about to place ourselves in a position of some peril?” “You may say so, sir, indeed,”"
20,a,"impressed his beholders. It was late in the afternoon, when Mr. Utterson found his way to Dr. Jekyll’s door, where he was at once admitted by Poole, and carried down by the kitchen offices and across a yard which had once been a garden, to the building which was indifferently known as the laboratory or dissecting rooms. The doctor had bought the house from the heirs of a celebrated surgeon; and his own tastes being rather chemical than anatomical, had changed the destination of the block at the bottom of the garden. It was the first time that the lawyer"
21,a,"for the very purpose of these transformations. The night however, was far gone into the morning—the morning, black as it was, was nearly ripe for the conception of the day—the inmates of my house were locked in the most rigorous hours of slumber; and I determined, flushed as I was with hope and triumph, to venture in my new shape as far as to my bedroom. I crossed the yard, wherein the constellations looked down upon me, I could have thought, with wonder, the first creature of that sort that their unsleeping vigilance had yet disclosed to them; I stole"
22,a,"“Changed? Well, yes, I think so,” said the butler. “Have I been twenty years in this man’s house, to be deceived about his voice? No, sir; master’s made away with; he was made away with eight days ago, when we heard him cry out upon the name of God; and who’s in there instead of him, and why it stays there, is a thing that cries to Heaven, Mr. Utterson!” “This is a very strange tale, Poole; this is rather a wild tale my man,” said Mr. Utterson, biting his finger. “Suppose it were as you suppose, supposing Dr. Jekyll"
23,a,"all of a sudden he broke out in a great flame of anger, stamping with his foot, brandishing the cane, and carrying on (as the maid described it) like a madman. The old gentleman took a step back, with the air of one very much surprised and a trifle hurt; and at that Mr. Hyde broke out of all bounds and clubbed him to the earth. And next moment, with ape-like fury, he was trampling his victim under foot and hailing down a storm of blows, under which the bones were audibly shattered and the body jumped upon the roadway."
24,a,"reading of this letter, I made sure my colleague was insane; but till that was proved beyond the possibility of doubt, I felt bound to do as he requested. The less I understood of this farrago, the less I was in a position to judge of its importance; and an appeal so worded could not be set aside without a grave responsibility. I rose accordingly from table, got into a hansom, and drove straight to Jekyll’s house. The butler was awaiting my arrival; he had received by the same post as mine a registered letter of instruction, and had sent"
25,a,"strong light on this consciousness of the perennial war among my members. With every day, and from both sides of my intelligence, the moral and the intellectual, I thus drew steadily nearer to that truth, by whose partial discovery I have been doomed to such a dreadful shipwreck: that man is not truly one, but truly two. I say two, because the state of my own knowledge does not pass beyond that point. Others will follow, others will outstrip me on the same lines; and I hazard the guess that man will be ultimately known for a mere polity of"
26,a,"cabinet; and if that were so, it must be differently judged, and handled with the more caution. The newsboys, as he went, were crying themselves hoarse along the footways: “Special edition. Shocking murder of an M.P.” That was the funeral oration of one friend and client; and he could not help a certain apprehension lest the good name of another should be sucked down in the eddy of the scandal. It was, at least, a ticklish decision that he had to make; and self-reliant as he was by habit, he began to cherish a longing for advice. It was not"
27,a,"it mutter and felt it struggle to be born; and at every hour of weakness, and in the confidence of slumber, prevailed against him, and deposed him out of life. The hatred of Hyde for Jekyll was of a different order. His terror of the gallows drove him continually to commit temporary suicide, and return to his subordinate station of a part instead of a person; but he loathed the necessity, he loathed the despondency into which Jekyll was now fallen, and he resented the dislike with which he was himself regarded. Hence the ape-like tricks that he would play"
28,a,"balderdash,” added the doctor, flushing suddenly purple, “would have estranged Damon and Pythias.” This little spirit of temper was somewhat of a relief to Mr. Utterson. “They have only differed on some point of science,” he thought; and being a man of no scientific passions (except in the matter of conveyancing), he even added: “It is nothing worse than that!” He gave his friend a few seconds to recover his composure, and then approached the question he had come to put. “Did you ever come across a protégé of his—one Hyde?” he asked. “Hyde?” repeated Lanyon. “No. Never heard of"
29,a,"The large handsome face of Dr. Jekyll grew pale to the very lips, and there came a blackness about his eyes. “I do not care to hear more,” said he. “This is a matter I thought we had agreed to drop.” “What I heard was abominable,” said Utterson. “It can make no change. You do not understand my position,” returned the doctor, with a certain incoherency of manner. “I am painfully situated, Utterson; my position is a very strange—a very strange one. It is one of those affairs that cannot be mended by talking.” “Jekyll,” said Utterson, “you know me:"
30,a,"as well we have met; and à propos, you should have my address.” And he gave a number of a street in Soho. “Good God!” thought Mr. Utterson, “can he, too, have been thinking of the will?” But he kept his feelings to himself and only grunted in acknowledgment of the address. “And now,” said the other, “how did you know me?” “By description,” was the reply. “Whose description?” “We have common friends,” said Mr. Utterson. “Common friends,” echoed Mr. Hyde, a little hoarsely. “Who are they?” “Jekyll, for instance,” said the lawyer. “He never told you,” cried Mr. Hyde,"
31,a,"of musing. From this he was recalled by Mr. Utterson asking rather suddenly: “And you don’t know if the drawer of the cheque lives there?” “A likely place, isn’t it?” returned Mr. Enfield. “But I happen to have noticed his address; he lives in some square or other.” “And you never asked about the—place with the door?” said Mr. Utterson. “No, sir; I had a delicacy,” was the reply. “I feel very strongly about putting questions; it partakes too much of the style of the day of judgment. You start a question, and it’s like starting a stone. You sit"
32,a,"near along the lane; and advancing to meet him, another and very small gentleman, to whom at first she paid less attention. When they had come within speech (which was just under the maid’s eyes) the older man bowed and accosted the other with a very pretty manner of politeness. It did not seem as if the subject of his address were of great importance; indeed, from his pointing, it sometimes appeared as if he were only inquiring his way; but the moon shone on his face as he spoke, and the girl was pleased to watch it, it seemed"
33,a,"night however, was far gone into the morning—the morning, black as it was, was nearly ripe for the conception of the day—the inmates of my house were locked in the most rigorous hours of slumber; and I determined, flushed as I was with hope and triumph, to venture in my new shape as far as to my bedroom. I crossed the yard, wherein the constellations looked down upon me, I could have thought, with wonder, the first creature of that sort that their unsleeping vigilance had yet disclosed to them; I stole through the corridors, a stranger in my own"
34,a,"he cried. “I trust you are better.” “I am very low, Utterson,” replied the doctor drearily, “very low. It will not last long, thank God.” “You stay too much indoors,” said the lawyer. “You should be out, whipping up the circulation like Mr. Enfield and me. (This is my cousin—Mr. Enfield—Dr. Jekyll.) Come now; get your hat and take a quick turn with us.” “You are very good,” sighed the other. “I should like to very much; but no, no, no, it is quite impossible; I dare not. But indeed, Utterson, I am very glad to see you; this is"
35,a,"recall the abjection and passion of this attachment, and when I know how he fears my power to cut him off by suicide, I find it in my heart to pity him. It is useless, and the time awfully fails me, to prolong this description; no one has ever suffered such torments, let that suffice; and yet even to these, habit brought—no, not alleviation—but a certain callousness of soul, a certain acquiescence of despair; and my punishment might have gone on for years, but for the last calamity which has now fallen, and which has finally severed me from my"
36,a,"if I slept, or even dozed for a moment in my chair, it was always as Hyde that I awakened. Under the strain of this continually impending doom and by the sleeplessness to which I now condemned myself, ay, even beyond what I had thought possible to man, I became, in my own person, a creature eaten up and emptied by fever, languidly weak both in body and mind, and solely occupied by one thought: the horror of my other self. But when I slept, or when the virtue of the medicine wore off, I would leap almost without transition"
37,a,"salads, many ragged children huddled in the doorways, and many women of many different nationalities passing out, key in hand, to have a morning glass; and the next moment the fog settled down again upon that part, as brown as umber, and cut him off from his blackguardly surroundings. This was the home of Henry Jekyll’s favourite; of a man who was heir to a quarter of a million sterling. An ivory-faced and silvery-haired old woman opened the door. She had an evil face, smoothed by hypocrisy: but her manners were excellent. Yes, she said, this was Mr. Hyde’s, but"
38,a,"and I hazard the guess that man will be ultimately known for a mere polity of multifarious, incongruous and independent denizens. I, for my part, from the nature of my life, advanced infallibly in one direction and in one direction only. It was on the moral side, and in my own person, that I learned to recognise the thorough and primitive duality of man; I saw that, of the two natures that contended in the field of my consciousness, even if I could rightly be said to be either, it was only because I was radically both; and from an"
39,a,"heart in your ears, Mr. Utterson, and tell me, is that the doctor’s foot?” The steps fell lightly and oddly, with a certain swing, for all they went so slowly; it was different indeed from the heavy creaking tread of Henry Jekyll. Utterson sighed. “Is there never anything else?” he asked. Poole nodded. “Once,” he said. “Once I heard it weeping!” “Weeping? how that?” said the lawyer, conscious of a sudden chill of horror. “Weeping like a woman or a lost soul,” said the butler. “I came away with that upon my heart, that I could have wept too.” But"
40,a,"him some of the phenomena of consciousness, and was co-heir with him to death: and beyond these links of community, which in themselves made the most poignant part of his distress, he thought of Hyde, for all his energy of life, as of something not only hellish but inorganic. This was the shocking thing; that the slime of the pit seemed to utter cries and voices; that the amorphous dust gesticulated and sinned; that what was dead, and had no shape, should usurp the offices of life. And this again, that that insurgent horror was knit to him closer than"
41,a,"the bones, deadly nausea, and a horror of the spirit that cannot be exceeded at the hour of birth or death. Then these agonies began swiftly to subside, and I came to myself as if out of a great sickness. There was something strange in my sensations, something indescribably new and, from its very novelty, incredibly sweet. I felt younger, lighter, happier in body; within I was conscious of a heady recklessness, a current of disordered sensual images running like a millrace in my fancy, a solution of the bonds of obligation, an unknown but not an innocent freedom of"
42,a,"do about it; it is an ugly business at the best. But there it is; quite in your way: a murderer’s autograph.” Guest’s eyes brightened, and he sat down at once and studied it with passion. “No sir,” he said: “not mad; but it is an odd hand.” “And by all accounts a very odd writer,” added the lawyer. Just then the servant entered with a note. “Is that from Dr. Jekyll, sir?” inquired the clerk. “I thought I knew the writing. Anything private, Mr. Utterson?” “Only an invitation to dinner. Why? Do you want to see it?” “One moment."
43,a,"night under the face of the fogged city moon, by all lights and at all hours of solitude or concourse, the lawyer was to be found on his chosen post. “If he be Mr. Hyde,” he had thought, “I shall be Mr. Seek.” And at last his patience was rewarded. It was a fine dry night; frost in the air; the streets as clean as a ballroom floor; the lamps, unshaken by any wind, drawing a regular pattern of light and shadow. By ten o’clock, when the shops were closed, the by-street was very solitary and, in spite of the"
44,a,"I am at a loss whether I should show it to the police. I should like to leave it in your hands, Utterson; you would judge wisely, I am sure; I have so great a trust in you.” “You fear, I suppose, that it might lead to his detection?” asked the lawyer. “No,” said the other. “I cannot say that I care what becomes of Hyde; I am quite done with him. I was thinking of my own character, which this hateful business has rather exposed.” Utterson ruminated awhile; he was surprised at his friend’s selfishness, and yet relieved by"
45,a,"am no longer here.” Utterson heaved an irrepressible sigh. “Well,” said he, “I promise.” Nearly a year later, in the month of October, 18—, London was startled by a crime of singular ferocity and rendered all the more notable by the high position of the victim. The details were few and startling. A maid servant living alone in a house not far from the river, had gone upstairs to bed about eleven. Although a fog rolled over the city in the small hours, the early part of the night was cloudless, and the lane, which the maid’s window overlooked, was"
