,Author,Text
471,c,"his back, peel him away from the bed, bend down with the load and then be patient and careful as he swang over onto the floor, where, hopefully, the little legs would find a use. Should he really call for help though, even apart from the fact that all the doors were locked? Despite all the difficulty he was in, he could not suppress a smile at this thought. After a while he had already moved so far across that it would have been hard for him to keep his balance if he rocked too hard. The time was now"
472,c,"obsessed with what he was doing that he forgot all the respect he owed to his tenants. He urged them and pressed them until, when he was already at the door of the room, the middle of the three gentlemen shouted like thunder and stamped his foot and thereby brought Gregor’s father to a halt. “I declare here and now”, he said, raising his hand and glancing at Gregor’s mother and sister to gain their attention too, “that with regard to the repugnant conditions that prevail in this flat and with this family”—here he looked briefly but decisively at the"
473,c,"so that that, too, had been accumulating. Behind the door, Gregor nodded with enthusiasm in his pleasure at this unexpected thrift and caution. He could actually have used this surplus money to reduce his father’s debt to his boss, and the day when he could have freed himself from that job would have come much closer, but now it was certainly better the way his father had done things. This money, however, was certainly not enough to enable the family to live off the interest; it was enough to maintain them for, perhaps, one or two years, no more. That’s"
474,c,"alarm clock not rung? He could see from the bed that it had been set for four o’clock as it should have been; it certainly must have rung. Yes, but was it possible to quietly sleep through that furniture-rattling noise? True, he had not slept peacefully, but probably all the more deeply because of that. What should he do now? The next train went at seven; if he were to catch that he would have to rush like mad and the collection of samples was still not packed, and he did not at all feel particularly fresh and lively. And"
475,c,"was impossible for Gregor to find out what they had told the doctor and the locksmith that first morning to get them out of the flat. As nobody could understand him, nobody, not even his sister, thought that he could understand them, so he had to be content to hear his sister’s sighs and appeals to the saints as she moved about his room. It was only later, when she had become a little more used to everything—there was, of course, no question of her ever becoming fully used to the situation—that Gregor would sometimes catch a friendly comment, or"
476,c,"made plans of how he could get into the pantry where he could take all the things he was entitled to, even if he was not hungry. Gregor’s sister no longer thought about how she could please him but would hurriedly push some food or other into his room with her foot before she rushed out to work in the morning and at midday, and in the evening she would sweep it away again with the broom, indifferent as to whether it had been eaten or—more often than not—had been left totally untouched. She still cleared up the room in"
477,c,"if he were both angry and glad at the same time. Gregor drew his head back from the door and lifted it towards his father. He really had not imagined his father the way he stood there now; of late, with his new habit of crawling about, he had neglected to pay attention to what was going on the rest of the flat the way he had done before. He really ought to have expected things to have changed, but still, still, was that really his father? The same tired man as used to be laying there entombed in his"
478,c,"and the few drops of milk splashed around it with some surprise. She immediately picked it up—using a rag, not her bare hands—and carried it out. Gregor was extremely curious as to what she would bring in its place, imagining the wildest possibilities, but he never could have guessed what his sister, in her goodness, actually did bring. In order to test his taste, she brought him a whole selection of things, all spread out on an old newspaper. There were old, half-rotten vegetables; bones from the evening meal, covered in white sauce that had gone hard; a few raisins"
479,c,"probably, some bank, and threw it in an arc right across the room onto the sofa, put his hands in his trouser pockets, pushing back the bottom of his long uniform coat, and, with look of determination, walked towards Gregor. He probably did not even know himself what he had in mind, but nonetheless lifted his feet unusually high. Gregor was amazed at the enormous size of the soles of his boots, but wasted no time with that—he knew full well, right from the first day of his new life, that his father thought it necessary to always be extremely"
480,c,"off so completely. She left the sheet where it was. Gregor even thought he glimpsed a look of gratitude one time when he carefully looked out from under the sheet to see how his sister liked the new arrangement. For the first fourteen days, Gregor’s parents could not bring themselves to come into the room to see him. He would often hear them say how they appreciated all the new work his sister was doing even though, before, they had seen her as a girl who was somewhat useless and frequently been annoyed with her. But now the two of"
481,c,"though, he did not forget to remind himself that calm consideration was much better than rushing to desperate conclusions. At times like this he would direct his eyes to the window and look out as clearly as he could, but unfortunately, even the other side of the narrow street was enveloped in morning fog and the view had little confidence or cheer to offer him. “Seven o’clock, already”, he said to himself when the clock struck again, “seven o’clock, and there’s still a fog like this.” And he lay there quietly a while longer, breathing lightly as if he perhaps"
482,c,"effort to remove all the strangeness from his voice by enunciating very carefully and putting long pauses between each, individual word. His father went back to his breakfast, but his sister whispered: “Gregor, open the door, I beg of you.” Gregor, however, had no thought of opening the door, and instead congratulated himself for his cautious habit, acquired from his travelling, of locking all doors at night even when he was at home. The first thing he wanted to do was to get up in peace without being disturbed, to get dressed, and most of all to have his breakfast."
483,c,"to bring the timorous visitor into the room in some way or at least to find out who it was; but the door was opened no more that night and Gregor waited in vain. The previous morning while the doors were locked everyone had wanted to get in there to him, but now, now that he had opened up one of the doors and the other had clearly been unlocked some time during the day, no-one came, and the keys were in the other sides. It was not until late at night that the gaslight in the living room was"
484,c,"this surplus money to reduce his father’s debt to his boss, and the day when he could have freed himself from that job would have come much closer, but now it was certainly better the way his father had done things. This money, however, was certainly not enough to enable the family to live off the interest; it was enough to maintain them for, perhaps, one or two years, no more. That’s to say, it was money that should not really be touched but set aside for emergencies; money to live on had to be earned. His father was healthy"
485,c,"of them at first just nodded without looking up from what they were writing, and it was only when the cleaner still did not seem to want to leave that they looked up in irritation. “Well?”, asked Mr. Samsa. The charwoman stood in the doorway with a smile on her face as if she had some tremendous good news to report, but would only do it if she was clearly asked to. The almost vertical little ostrich feather on her hat, which had been a source of irritation to Mr. Samsa all the time she had been working for them,"
486,c,"as his mother was satisfied with this explanation and shuffled away. But this short conversation made the other members of the family aware that Gregor, against their expectations was still at home, and soon his father came knocking at one of the side doors, gently, but with his fist. “Gregor, Gregor”, he called, “what’s wrong?” And after a short while he called again with a warning deepness in his voice: “Gregor! Gregor!” At the other side door his sister came plaintively: “Gregor? Aren’t you well? Do you need anything?” Gregor answered to both sides: “I’m ready, now”, making an effort"
487,c,"any thought for the future. Gregor, though, did think about the future. The chief clerk had to be held back, calmed down, convinced and finally won over; the future of Gregor and his family depended on it! If only his sister were here! She was clever; she was already in tears while Gregor was still lying peacefully on his back. And the chief clerk was a lover of women, surely she could persuade him; she would close the front door in the entrance hall and talk him out of his shocked state. But his sister was not there, Gregor would"
488,c,"his mouth to play with it, leave it there a few hours and then, more often than not, spit it out again. At first he thought it was distress at the state of his room that stopped him eating, but he had soon got used to the changes made there. They had got into the habit of putting things into this room that they had no room for anywhere else, and there were now many such things as one of the rooms in the flat had been rented out to three gentlemen. These earnest gentlemen—all three of them had full"
489,c,"the harmful effects of what’s been going on without even knowing what caused them. Please, don’t go away, at least first say something to show that you grant that I’m at least partly right!” But the chief clerk had turned away as soon as Gregor had started to speak, and, with protruding lips, only stared back at him over his trembling shoulders as he left. He did not keep still for a moment while Gregor was speaking, but moved steadily towards the door without taking his eyes off him. He moved very gradually, as if there had been some secret"
490,c,"around it with some surprise. She immediately picked it up—using a rag, not her bare hands—and carried it out. Gregor was extremely curious as to what she would bring in its place, imagining the wildest possibilities, but he never could have guessed what his sister, in her goodness, actually did bring. In order to test his taste, she brought him a whole selection of things, all spread out on an old newspaper. There were old, half-rotten vegetables; bones from the evening meal, covered in white sauce that had gone hard; a few raisins and almonds; some cheese that Gregor had"
491,c,"monogram from, probably, some bank, and threw it in an arc right across the room onto the sofa, put his hands in his trouser pockets, pushing back the bottom of his long uniform coat, and, with look of determination, walked towards Gregor. He probably did not even know himself what he had in mind, but nonetheless lifted his feet unusually high. Gregor was amazed at the enormous size of the soles of his boots, but wasted no time with that—he knew full well, right from the first day of his new life, that his father thought it necessary to always"
492,c,"the effort to carry him where he wanted to go; and he was soon believing that all his sorrows would soon be finally at an end. He held back the urge to move but swayed from side to side as he crouched there on the floor. His mother was not far away in front of him and seemed, at first, quite engrossed in herself, but then she suddenly jumped up with her arms outstretched and her fingers spread shouting: “Help, for pity’s sake, Help!” The way she held her head suggested she wanted to see Gregor better, but the unthinking"
493,c,"in near perfect silence. It seemed remarkable to Gregor that above all the various noises of eating their chewing teeth could still be heard, as if they had wanted to show Gregor that you need teeth in order to eat and it was not possible to perform anything with jaws that are toothless however nice they might be. “I’d like to eat something”, said Gregor anxiously, “but not anything like they’re eating. They do feed themselves. And here I am, dying!” Throughout all this time, Gregor could not remember having heard the violin being played, but this evening it began"
494,c,"had become convinced that this job would provide for Gregor for his entire life, and besides, they had so much to worry about at present that they had lost sight of any thought for the future. Gregor, though, did think about the future. The chief clerk had to be held back, calmed down, convinced and finally won over; the future of Gregor and his family depended on it! If only his sister were here! She was clever; she was already in tears while Gregor was still lying peacefully on his back. And the chief clerk was a lover of women,"
495,c,"have been living here I will, of course, pay nothing at all, on the contrary I will consider whether to proceed with some kind of action for damages from you, and believe me it would be very easy to set out the grounds for such an action.” He was silent and looked straight ahead as if waiting for something. And indeed, his two friends joined in with the words: “And we also give immediate notice.” With that, he took hold of the door handle and slammed the door. Gregor’s father staggered back to his seat, feeling his way with his"
496,c,"immobile. “We have to try and get rid of it”, said Gregor’s sister, now speaking only to her father, as her mother was too occupied with coughing to listen, “it’ll be the death of both of you, I can see it coming. We can’t all work as hard as we have to and then come home to be tortured like this, we can’t endure it. I can’t endure it any more.” And she broke out so heavily in tears that they flowed down the face of her mother, and she wiped them away with mechanical hand movements. “My child”, said"
497,c,"himself up; but instead of them he only had all those little legs continuously moving in different directions, and which he was moreover unable to control. If he wanted to bend one of them, then that was the first one that would stretch itself out; and if he finally managed to do what he wanted with that leg, all the others seemed to be set free and would move about painfully. “This is something that can’t be done in bed”, Gregor said to himself, “so don’t keep trying to do it”. The first thing he wanted to do was get"
498,c,"to wait until midday before his sister came back and she seemed much more uneasy than usual. It made him realise that she still found his appearance unbearable and would continue to do so, she probably even had to overcome the urge to flee when she saw the little bit of him that protruded from under the couch. One day, in order to spare her even this sight, he spent four hours carrying the bedsheet over to the couch on his back and arranged it so that he was completely covered and his sister would not be able to see"
499,c,"representative almost overnight, bringing with it the chance to earn money in quite different ways. Gregor converted his success at work straight into cash that he could lay on the table at home for the benefit of his astonished and delighted family. They had been good times and they had never come again, at least not with the same splendour, even though Gregor had later earned so much that he was in a position to bear the costs of the whole family, and did bear them. They had even got used to it, both Gregor and the family, they took"
500,c,"chance. Gregor also refrained, this time, from spying out from under the sheet; he gave up the chance to see his mother until later and was simply glad that she had come. “You can come in, he can’t be seen”, said his sister, obviously leading her in by the hand. The old chest of drawers was too heavy for a pair of feeble women to be heaving about, but Gregor listened as they pushed it from its place, his sister always taking on the heaviest part of the work for herself and ignoring her mother’s warnings that she would strain"
501,c,"backwards and was only able to go very slowly. If Gregor had only been allowed to turn round he would have been back in his room straight away, but he was afraid that if he took the time to do that his father would become impatient, and there was the threat of a lethal blow to his back or head from the stick in his father’s hand any moment. Eventually, though, Gregor realised that he had no choice as he saw, to his disgust, that he was quite incapable of going backwards in a straight line; so he began, as"
502,c,"day with this running about and noise making; he would stay under the couch shivering the whole while, knowing full well that she would certainly have liked to spare him this ordeal, but it was impossible for her to be in the same room with him with the windows closed. One day, about a month after Gregor’s transformation when his sister no longer had any particular reason to be shocked at his appearance, she came into the room a little earlier than usual and found him still staring out the window, motionless, and just where he would be most horrible."
503,c,"clear whether it was his father’s behaviour that annoyed them or the dawning realisation that they had had a neighbour like Gregor in the next room without knowing it. They asked Gregor’s father for explanations, raised their arms like he had, tugged excitedly at their beards and moved back towards their room only very slowly. Meanwhile Gregor’s sister had overcome the despair she had fallen into when her playing was suddenly interrupted. She had let her hands drop and let violin and bow hang limply for a while but continued to look at the music as if still playing, but"
504,c,"his fists as if wanting to knock Gregor back into his room. Then he looked uncertainly round the living room, covered his eyes with his hands and wept so that his powerful chest shook. So Gregor did not go into the room, but leant against the inside of the other door which was still held bolted in place. In this way only half of his body could be seen, along with his head above it which he leant over to one side as he peered out at the others. Meanwhile the day had become much lighter; part of the endless,"
505,c,"from the office, so that we can very easily fall victim to gossip and chance and groundless complaints, and it’s almost impossible to defend yourself from that sort of thing, we don’t usually even hear about them, or if at all it’s when we arrive back home exhausted from a trip, and that’s when we feel the harmful effects of what’s been going on without even knowing what caused them. Please, don’t go away, at least first say something to show that you grant that I’m at least partly right!” But the chief clerk had turned away as soon as"
506,c,"the others didn’t know what was happening, they were worried, that would excuse their behaviour. The chief clerk now raised his voice, “Mr. Samsa”, he called to him, “what is wrong? You barricade yourself in your room, give us no more than yes or no for an answer, you are causing serious and unnecessary concern to your parents and you fail—and I mention this just by the way—you fail to carry out your business duties in a way that is quite unheard of. I’m speaking here on behalf of your parents and of your employer, and really must request a"
507,c,"turning, ignoring the fact that he must have been causing some kind of damage as a brown fluid came from his mouth, flowed over the key and dripped onto the floor. “Listen”, said the chief clerk in the next room, “he’s turning the key.” Gregor was greatly encouraged by this; but they all should have been calling to him, his father and his mother too: “Well done, Gregor”, they should have cried, “keep at it, keep hold of the lock!” And with the idea that they were all excitedly following his efforts, he bit on the key with all his"
508,c,"lived in Charlottenstrasse, which was a quiet street despite being in the middle of the city, he could have thought that he was looking out the window at a barren waste where the grey sky and the grey earth mingled inseparably. His observant sister only needed to notice the chair twice before she would always push it back to its exact position by the window after she had tidied up the room, and even left the inner pane of the window open from then on. If Gregor had only been able to speak to his sister and thank her for"
509,c,"The maid, of course, had locked herself in her kitchen so that Grete would have to go and answer it. His father had arrived home. “What’s happened?” were his first words; Grete’s appearance must have made everything clear to him. She answered him with subdued voice, and openly pressed her face into his chest: “Mother’s fainted, but she’s better now. Gregor got out.” “Just as I expected”, said his father, “just as I always said, but you women wouldn’t listen, would you.” It was clear to Gregor that Grete had not said enough and that his father took it to"
510,c,"thought that he could understand them, so he had to be content to hear his sister’s sighs and appeals to the saints as she moved about his room. It was only later, when she had become a little more used to everything—there was, of course, no question of her ever becoming fully used to the situation—that Gregor would sometimes catch a friendly comment, or at least a comment that could be construed as friendly. “He’s enjoyed his dinner today”, she might say when he had diligently cleared away all the food left for him, or if he left most of"
511,c,"did not forget to remind himself that calm consideration was much better than rushing to desperate conclusions. At times like this he would direct his eyes to the window and look out as clearly as he could, but unfortunately, even the other side of the narrow street was enveloped in morning fog and the view had little confidence or cheer to offer him. “Seven o’clock, already”, he said to himself when the clock struck again, “seven o’clock, and there’s still a fog like this.” And he lay there quietly a while longer, breathing lightly as if he perhaps expected the"
512,c,"to hold onto, landed on his numerous little legs. Hardly had that happened than, for the first time that day, he began to feel alright with his body; the little legs had the solid ground under them; to his pleasure, they did exactly as he told them; they were even making the effort to carry him where he wanted to go; and he was soon believing that all his sorrows would soon be finally at an end. He held back the urge to move but swayed from side to side as he crouched there on the floor. His mother was"
513,c,"for so long. The food came out again just the same as when it went in”. Gregor’s body was indeed completely dried up and flat, they had not seen it until then, but now he was not lifted up on his little legs, nor did he do anything to make them look away. “Grete, come with us in here for a little while”, said Mrs. Samsa with a pained smile, and Grete followed her parents into the bedroom but not without looking back at the body. The cleaner shut the door and opened the window wide. Although it was still"
514,c,"to his father, stopped when his father stopped, scurried forwards again when he moved, even slightly. In this way they went round the room several times without anything decisive happening, without even giving the impression of a chase as everything went so slowly. Gregor remained all this time on the floor, largely because he feared his father might see it as especially provoking if he fled onto the wall or ceiling. Whatever he did, Gregor had to admit that he certainly would not be able to keep up this running about for long, as for each step his father took"
515,c,"sister liked the new arrangement. For the first fourteen days, Gregor’s parents could not bring themselves to come into the room to see him. He would often hear them say how they appreciated all the new work his sister was doing even though, before, they had seen her as a girl who was somewhat useless and frequently been annoyed with her. But now the two of them, father and mother, would often both wait outside the door of Gregor’s room while his sister tidied up in there, and as soon as she went out again she would have to tell"
516,c,"in gruff reply to this question, the chief clerk’s firm footsteps in his highly polished boots could now be heard in the adjoining room. From the room on his right, Gregor’s sister whispered to him to let him know: “Gregor, the chief clerk is here.” “Yes, I know”, said Gregor to himself; but without daring to raise his voice loud enough for his sister to hear him. “Gregor”, said his father now from the room to his left, “the chief clerk has come round and wants to know why you didn’t leave on the early train. We don’t know what"
