,Author,Text
748,d,"what I was doing. To do it in any way was an act of violence, for what did it consist of but the obtrusion of the idea of grossness and guilt on a small helpless creature who had been for me a revelation of the possibilities of beautiful intercourse? Wasn’t it base to create for a being so exquisite a mere alien awkwardness? I suppose I now read into our situation a clearness it couldn’t have had at the time, for I seem to see our poor eyes already lighted with some spark of a prevision of the anguish that"
749,d,"in a glow of high fashion, of good looks, of expensive habits, of charming ways with women. He had for his own town residence a big house filled with the spoils of travel and the trophies of the chase; but it was to his country home, an old family place in Essex, that he wished her immediately to proceed. He had been left, by the death of their parents in India, guardian to a small nephew and a small niece, children of a younger, a military brother, whom he had lost two years before. These children were, by the strangest"
750,d,"nothing in the world but love. It would have been impossible to carry a bad name with a greater sweetness of innocence, and by the time I had got back to Bly with him I remained merely bewildered—so far, that is, as I was not outraged—by the sense of the horrible letter locked up in my room, in a drawer. As soon as I could compass a private word with Mrs. Grose I declared to her that it was grotesque. She promptly understood me. “You mean the cruel charge—?” “It doesn’t live an instant. My dear woman, look at him!”"
751,d,"coach that carried me to the stopping place at which I was to be met by a vehicle from the house. This convenience, I was told, had been ordered, and I found, toward the close of the June afternoon, a commodious fly in waiting for me. Driving at that hour, on a lovely day, through a country to which the summer sweetness seemed to offer me a friendly welcome, my fortitude mounted afresh and, as we turned into the avenue, encountered a reprieve that was probably but a proof of the point to which it had sunk. I suppose I"
752,d,"I had simply gone straight to my room to change what I was wearing and to take in, at a glance, much material testimony to Flora’s rupture. Her little belongings had all been removed. When later, by the schoolroom fire, I was served with tea by the usual maid, I indulged, on the article of my other pupil, in no inquiry whatever. He had his freedom now—he might have it to the end! Well, he did have it; and it consisted—in part at least—of his coming in at about eight o’clock and sitting down with me in silence. On the"
753,d,"false note, the happiest of arrangements, with Mrs. Grose. I saw neither of them on my return, but, on the other hand, as by an ambiguous compensation, I saw a great deal of Miles. I saw—I can use no other phrase—so much of him that it was as if it were more than it had ever been. No evening I had passed at Bly had the portentous quality of this one; in spite of which—and in spite also of the deeper depths of consternation that had opened beneath my feet—there was literally, in the ebbing actual, an extraordinarily sweet sadness."
754,d,"the place and looked, I have no doubt, as if I were ready for any onset. So, for the benefit of whom it might concern, I paraded with a sick heart. The person it appeared least to concern proved to be, till dinner, little Miles himself. My perambulations had given me, meanwhile, no glimpse of him, but they had tended to make more public the change taking place in our relation as a consequence of his having at the piano, the day before, kept me, in Flora’s interest, so beguiled and befooled. The stamp of publicity had of course been"
755,d,"and they were again, with Mrs. Grose on her feet, united, as it were, in pained opposition to me. Flora continued to fix me with her small mask of reprobation, and even at that minute I prayed God to forgive me for seeming to see that, as she stood there holding tight to our friend’s dress, her incomparable childish beauty had suddenly failed, had quite vanished. I’ve said it already—she was literally, she was hideously, hard; she had turned common and almost ugly. “I don’t know what you mean. I see nobody. I see nothing. I never have. I think"
756,d,"to show you I could!” “Oh, yes, you could.” “And I can again.” I felt that I might, perhaps, after all, succeed in keeping my wits about me. “Certainly. But you won’t.” “No, not that again. It was nothing.” “It was nothing,” I said. “But we must go on.” He resumed our walk with me, passing his hand into my arm. “Then when am I going back?” I wore, in turning it over, my most responsible air. “Were you very happy at school?” He just considered. “Oh, I’m happy enough anywhere!” “Well, then,” I quavered, “if you’re just as happy"
757,d,"he were innocent, what then on earth was I? Paralyzed, while it lasted, by the mere brush of the question, I let him go a little, so that, with a deep-drawn sigh, he turned away from me again; which, as he faced toward the clear window, I suffered, feeling that I had nothing now there to keep him from. “And did they repeat what you said?” I went on after a moment. He was soon at some distance from me, still breathing hard and again with the air, though now without anger for it, of being confined against his will."
758,d,"that, however, he continued as if with the sense that this was an impertinence to be softened. “Nothing could be more charming than the way you take it, for of course if we’re alone together now it’s you that are alone most. But I hope,” he threw in, “you don’t particularly mind!” “Having to do with you?” I asked. “My dear child, how can I help minding? Though I’ve renounced all claim to your company—you’re so beyond me—I at least greatly enjoy it. What else should I stay on for?” He looked at me more directly, and the expression of"
759,d,"listened to the lash of the rain and the batter of the gusts. Finally I went out, taking a candle; I crossed the passage and listened a minute at Miles’s door. What, under my endless obsession, I had been impelled to listen for was some betrayal of his not being at rest, and I presently caught one, but not in the form I had expected. His voice tinkled out. “I say, you there—come in.” It was a gaiety in the gloom! I went in with my light and found him, in bed, very wide awake, but very much at his"
760,d,"a crisp, clear day, the first of its order for some time; the night had brought a touch of frost, and the autumn air, bright and sharp, made the church bells almost gay. It was an odd accident of thought that I should have happened at such a moment to be particularly and very gratefully struck with the obedience of my little charges. Why did they never resent my inexorable, my perpetual society? Something or other had brought nearer home to me that I had all but pinned the boy to my shawl and that, in the way our companions"
761,d,"but their beauty and amiability, their happiness and cleverness, she had no direct communication with the sources of my trouble. If they had been at all visibly blighted or battered, she would doubtless have grown, on tracing it back, haggard enough to match them; as matters stood, however, I could feel her, when she surveyed them, with her large white arms folded and the habit of serenity in all her look, thank the Lord’s mercy that if they were ruined the pieces would still serve. Flights of fancy gave place, in her mind, to a steady fireside glow, and I"
762,d,"the very things that have delighted, fascinated, and yet, at bottom, as I now so strangely see, mystified and troubled me. Their more than earthly beauty, their absolutely unnatural goodness. It’s a game,” I went on; “it’s a policy and a fraud!” “On the part of little darlings—?” “As yet mere lovely babies? Yes, mad as that seems!” The very act of bringing it out really helped me to trace it—follow it all up and piece it all together. “They haven’t been good—they’ve only been absent. It has been easy to live with them, because they’re simply leading a life"
763,d,"and saw it move and shift its posture. I have likened it to a sentinel, but its slow wheel, for a moment, was rather the prowl of a baffled beast. My present quickened courage, however, was such that, not too much to let it through, I had to shade, as it were, my flame. Meanwhile the glare of the face was again at the window, the scoundrel fixed as if to watch and wait. It was the very confidence that I might now defy him, as well as the positive certitude, by this time, of the child’s unconsciousness, that made"
764,d,"to the spectacle, he slowly changed his place—passed, looking at me hard all the while, to the opposite corner of the platform. Yes, I had the sharpest sense that during this transit he never took his eyes from me, and I can see at this moment the way his hand, as he went, passed from one of the crenelations to the next. He stopped at the other corner, but less long, and even as he turned away still markedly fixed me. He turned away; that was all I knew. It was not that I didn’t wait, on this occasion, for"
765,d,"The first day had been, on the whole, as I have expressed, reassuring; but I was to see it wind up in keen apprehension. The postbag, that evening—it came late—contained a letter for me, which, however, in the hand of my employer, I found to be composed but of a few words enclosing another, addressed to himself, with a seal still unbroken. “This, I recognize, is from the headmaster, and the headmaster’s an awful bore. Read him, please; deal with him; but mind you don’t report. Not a word. I’m off!” I broke the seal with a great effort—so great"
766,d,"fact that she was disturbed neither by my reillumination nor by the haste I made to get into slippers and into a wrap. Hidden, protected, absorbed, she evidently rested on the sill—the casement opened forward—and gave herself up. There was a great still moon to help her, and this fact had counted in my quick decision. She was face to face with the apparition we had met at the lake, and could now communicate with it as she had not then been able to do. What I, on my side, had to care for was, without disturbing her, to reach,"
767,d,"though the dining room was on the ground floor, not going down to the terrace on which he stood. His face was close to the glass, yet the effect of this better view was, strangely, only to show me how intense the former had been. He remained but a few seconds—long enough to convince me he also saw and recognized; but it was as if I had been looking at him for years and had known him always. Something, however, happened this time that had not happened before; his stare into my face, through the glass and across the room,"
768,d,"blunders, but he immensely pitied the poor chicks and had done all he could; had in particular sent them down to his other house, the proper place for them being of course the country, and kept them there, from the first, with the best people he could find to look after them, parting even with his own servants to wait on them and going down himself, whenever he might, to see how they were doing. The awkward thing was that they had practically no other relations and that his own affairs took up all his time. He had put them"
769,d,"stone dead on the road from the village: a catastrophe explained—superficially at least—by a visible wound to his head; such a wound as might have been produced—and as, on the final evidence, had been—by a fatal slip, in the dark and after leaving the public house, on the steepish icy slope, a wrong path altogether, at the bottom of which he lay. The icy slope, the turn mistaken at night and in liquor, accounted for much—practically, in the end and after the inquest and boundless chatter, for everything; but there had been matters in his life—strange passages and perils, secret"
770,d,"of the idea that he must know how he really, as they say, “had” me. He could do what he liked, with all his cleverness to help him, so long as I should continue to defer to the old tradition of the criminality of those caretakers of the young who minister to superstitions and fears. He “had” me indeed, and in a cleft stick; for who would ever absolve me, who would consent that I should go unhung, if, by the faintest tremor of an overture, I were the first to introduce into our perfect intercourse an element so dire?"
771,d,"I flashed into ice to challenge him. “Whom do you mean by ‘he’?” “Peter Quint—you devil!” His face gave again, round the room, its convulsed supplication. “Where?” They are in my ears still, his supreme surrender of the name and his tribute to my devotion. “What does he matter now, my own?—what will he ever matter? I have you,” I launched at the beast, “but he has lost you forever!” Then, for the demonstration of my work, “There, there!” I said to Miles. But he had already jerked straight round, stared, glared again, and seen but the quiet day. With"
772,d,"I felt, only too well; by which I mean that it suited exactly the particularly deadly view I was in the very act of forbidding myself to entertain. But I so far succeeded in checking the expression of this view that I will throw, just here, no further light on it than may be offered by the mention of my final observation to Mrs. Grose. “His having lied and been impudent are, I confess, less engaging specimens than I had hoped to have from you of the outbreak in him of the little natural man. Still,” I mused, “They must"
773,d,"have lasted as they actually appeared to me to last. The terrace and the whole place, the lawn and the garden beyond it, all I could see of the park, were empty with a great emptiness. There were shrubberies and big trees, but I remember the clear assurance I felt that none of them concealed him. He was there or was not there: not there if I didn’t see him. I got hold of this; then, instinctively, instead of returning as I had come, went to the window. It was confusedly present to me that I ought to place myself"
774,d,"on which my light made little impression, noiselessly closed and locked the door. I can say now neither what determined nor what guided me, but I went straight along the lobby, holding my candle high, till I came within sight of the tall window that presided over the great turn of the staircase. At this point I precipitately found myself aware of three things. They were practically simultaneous, yet they had flashes of succession. My candle, under a bold flourish, went out, and I perceived, by the uncovered window, that the yielding dusk of earliest morning rendered it unnecessary. Without"
775,d,"had no opportunity to ask him! This evening, you see,” I pursued, “he has not been able to get in.” “He only peeps?” “I hope it will be confined to that!” She had now let go my hand; she turned away a little. I waited an instant; then I brought out: “Go to church. Goodbye. I must watch.” Slowly she faced me again. “Do you fear for them?” We met in another long look. “Don’t you?” Instead of answering she came nearer to the window and, for a minute, applied her face to the glass. “You see how he could"
776,d,"morning. It was exactly as if they had both had at heart to gloss over any recent little friction. They performed the dizziest feats of arithmetic, soaring quite out of my feeble range, and perpetrated, in higher spirits than ever, geographical and historical jokes. It was conspicuous of course in Miles in particular that he appeared to wish to show how easily he could let me down. This child, to my memory, really lives in a setting of beauty and misery that no words can translate; there was a distinction all his own in every impulse he revealed; never was"
777,d,"any other, and it was in the condition of nerves produced by it that I made my actual inductions. They harassed me so that sometimes, at odd moments, I shut myself up audibly to rehearse—it was at once a fantastic relief and a renewed despair—the manner in which I might come to the point. I approached it from one side and the other while, in my room, I flung myself about, but I always broke down in the monstrous utterance of names. As they died away on my lips, I said to myself that I should indeed help them to"
778,d,"had come there. He had come for someone else. The flash of this knowledge—for it was knowledge in the midst of dread—produced in me the most extraordinary effect, started as I stood there, a sudden vibration of duty and courage. I say courage because I was beyond all doubt already far gone. I bounded straight out of the door again, reached that of the house, got, in an instant, upon the drive, and, passing along the terrace as fast as I could rush, turned a corner and came full in sight. But it was in sight of nothing now—my visitor"
779,d,"it occurred to me that I might occasionally excite suspicion by the little outbreaks of my sharper passion for them, so too I remember wondering if I mightn’t see a queerness in the traceable increase of their own demonstrations. They were at this period extravagantly and preternaturally fond of me; which, after all, I could reflect, was no more than a graceful response in children perpetually bowed over and hugged. The homage of which they were so lavish succeeded, in truth, for my nerves, quite as well as if I never appeared to myself, as I may say, literally to"
780,d,"idea, take all color out of storybooks and fairytales. Wasn’t it just a storybook over which I had fallen adoze and adream? No; it was a big, ugly, antique, but convenient house, embodying a few features of a building still older, half-replaced and half-utilized, in which I had the fancy of our being almost as lost as a handful of passengers in a great drifting ship. Well, I was, strangely, at the helm! This came home to me when, two days later, I drove over with Flora to meet, as Mrs. Grose said, the little gentleman; and all the more"
781,d,"envy of the comparative dusk of the pew and of the almost spiritual help of the hassock on which I might bend my knees. I seemed literally to be running a race with some confusion to which he was about to reduce me, but I felt that he had got in first when, before we had even entered the churchyard, he threw out— “I want my own sort!” It literally made me bound forward. “There are not many of your own sort, Miles!” I laughed. “Unless perhaps dear little Flora!” “You really compare me to a baby girl?” This found"
782,d,"than Miles has alluded to his expulsion. Oh, yes, we may sit here and look at them, and they may show off to us there to their fill; but even while they pretend to be lost in their fairytale they’re steeped in their vision of the dead restored. He’s not reading to her,” I declared; “they’re talking of them—they’re talking horrors! I go on, I know, as if I were crazy; and it’s a wonder I’m not. What I’ve seen would have made you so; but it has only made me more lucid, made me get hold of still other"
783,d,"something much worse.” “Worse than dislike?”—this left her indeed at a loss. “With a determination—indescribable. With a kind of fury of intention.” I made her turn pale. “Intention?” “To get hold of her.” Mrs. Grose—her eyes just lingering on mine—gave a shudder and walked to the window; and while she stood there looking out I completed my statement. “That’s what Flora knows.” After a little she turned round. “The person was in black, you say?” “In mourning—rather poor, almost shabby. But—yes—with extraordinary beauty.” I now recognized to what I had at last, stroke by stroke, brought the victim of my"
784,d,"“I don’t think your uncle much cares.” Miles, on this, stood looking at me. “Then don’t you think he can be made to?” “In what way?” “Why, by his coming down.” “But who’ll get him to come down?” “I will!” the boy said with extraordinary brightness and emphasis. He gave me another look charged with that expression and then marched off alone into church. The business was practically settled from the moment I never followed him. It was a pitiful surrender to agitation, but my being aware of this had somehow no power to restore me. I only sat there"
785,d,"and its agitation. The usual place of embarkation was half a mile from the house, but I had an intimate conviction that, wherever Flora might be, she was not near home. She had not given me the slip for any small adventure, and, since the day of the very great one that I had shared with her by the pond, I had been aware, in our walks, of the quarter to which she most inclined. This was why I had now given to Mrs. Grose’s steps so marked a direction—a direction that made her, when she perceived it, oppose a"
786,d,"still with her eyes. “Of what other things have you got hold?” “Why, of the very things that have delighted, fascinated, and yet, at bottom, as I now so strangely see, mystified and troubled me. Their more than earthly beauty, their absolutely unnatural goodness. It’s a game,” I went on; “it’s a policy and a fraud!” “On the part of little darlings—?” “As yet mere lovely babies? Yes, mad as that seems!” The very act of bringing it out really helped me to trace it—follow it all up and piece it all together. “They haven’t been good—they’ve only been absent."
787,d,"thing I could actively cultivate, and it may be imagined if I neglected now to address myself to this source for whatever it would yield. Stranger than I can express, certainly, was the effort to struggle against my new lights; it would doubtless have been, however, a greater tension still had it not been so frequently successful. I used to wonder how my little charges could help guessing that I thought strange things about them; and the circumstances that these things only made them more interesting was not by itself a direct aid to keeping them in the dark. I"
788,d,"we must clutch at that—we must cling to it! If it isn’t a proof of what you say, it’s a proof of—God knows what! For the woman’s a horror of horrors.” Mrs. Grose, at this, fixed her eyes a minute on the ground; then at last raising them, “Tell me how you know,” she said. “Then you admit it’s what she was?” I cried. “Tell me how you know,” my friend simply repeated. “Know? By seeing her! By the way she looked.” “At you, do you mean—so wickedly?” “Dear me, no—I could have borne that. She gave me never a"
789,d,"whatever, in me, was most excitable. The best way to picture it all is to say that I was off my guard. They gave me so little trouble—they were of a gentleness so extraordinary. I used to speculate—but even this with a dim disconnectedness—as to how the rough future (for all futures are rough!) would handle them and might bruise them. They had the bloom of health and happiness; and yet, as if I had been in charge of a pair of little grandees, of princes of the blood, for whom everything, to be right, would have to be enclosed"
790,d,"days were long; they often, at their finest, gave me what I used to call my own hour, the hour when, for my pupils, teatime and bedtime having come and gone, I had, before my final retirement, a small interval alone. Much as I liked my companions, this hour was the thing in the day I liked most; and I liked it best of all when, as the light faded—or rather, I should say, the day lingered and the last calls of the last birds sounded, in a flushed sky, from the old trees—I could take a turn into the"
791,d,"of admonition. Whatever he had been driven from school for, it was not for ugly feeding. He was irreproachable, as always, today; but he was unmistakably more conscious. He was discernibly trying to take for granted more things than he found, without assistance, quite easy; and he dropped into peaceful silence while he felt his situation. Our meal was of the briefest—mine a vain pretense, and I had the things immediately removed. While this was done Miles stood again with his hands in his little pockets and his back to me—stood and looked out of the wide window through which,"
792,d,"mean the face was—when, on the first of these occasions, at the end of a long June day, I stopped short on emerging from one of the plantations and coming into view of the house. What arrested me on the spot—and with a shock much greater than any vision had allowed for—was the sense that my imagination had, in a flash, turned real. He did stand there!—but high up, beyond the lawn and at the very top of the tower to which, on that first morning, little Flora had conducted me. This tower was one of a pair—square, incongruous, crenelated"
793,d,"I have you,” I launched at the beast, “but he has lost you forever!” Then, for the demonstration of my work, “There, there!” I said to Miles. But he had already jerked straight round, stared, glared again, and seen but the quiet day. With the stroke of the loss I was so proud of he uttered the cry of a creature hurled over an abyss, and the grasp with which I recovered him might have been that of catching him in his fall. I caught him, yes, I held him—it may be imagined with what a passion; but at the"
